comment_id,comment_text,language;
7541588128068518711,You’re*,en;
7642783126925918990,girl plz be fr 😭,en;
7536283943680918279,imma touch you instead👉👈,en;
7160755722559734533,C’est inadmissible de laisser les jeunes dans cet état critique de précarité,fr;
"7034971215555543814,""Take note, this is how you tell a story with emotion, sign language and a lil bit of crazy"",en;,,";
7601518698964304670,Tu étudies où?,fr;
7522544599178887958,howw girll am that type of girl that's use her phone everytime I can't forget my phone ee haha,en;
7639672608983679751,well i m not an extrovert nor a introvert i m just a temporary human being in everyones life,en;
7638410109525639956,Attends t’es pas allé au Costco,fr;
7642922949109187348,bro when we are going so far like a long ride I would not sleep and wait for it😭🥀💔,en;
"7626476552557757206,""Sonic,is that you?"",en;,,";
7638108204535218964,No bro 😂,en;
7642180835844244245,[Sticker] His eyes,sticker;
7643068536931959574,[Sticker] the neymar picture,sticker;
7215373472079545090,Great stuff. Love watching these. Keep it on 🙂,en;
7424780702500012803,I’d like to thank Beyoncé for what I just saw 😍,en;
7503365101949485846,At least she didn’t realize when they were in the hotel and the plane is already carrying another set of passengers,en;
7639483937571881729,[Sticker] cual collar,sticker;
6926336257094565893,This was one of the songs we learned in French in high school,en;
7322711232954385195,fr fr tho lol,en;
7642774436282761997,Ngl I would love to have a friend like this,en;
"6940781704248311813,""I’ve never seen this, thank goodness the first time I saw it , was on this side of tiktok instead!"",en;,,";
7521247887050474296,Why can I see myself doing that 😭,en;
"GOOD PEOPLE LEAVE US""""."",en;,,";
7620157939965444886,bro 💀,en;
6991273126693159685,Is he staining the floor?,en;
7364005217748583173,omg I just saw my dream guyyy (YOHAN),en;
7642839230196548365,ok but why,en;
7638149292096242465,mais qu'est ce qui te plaît au juste aux États-Unis ?? J'y étais de 92 à 95 et j'ai adoré !,fr;
"7642399204232397600,""js so yk, i'd sit w you if I saw you sitting alone"",en;,,";
7642732722809340703,wait bc it’s either this or im waiting for her to get out on the the toilet 😭,en;
7616842086612615958,ESPERANZA FROM RAISING DION 😁,en;
7446038924408914710,i can see the future…,en;
"7608955243796661023,""[Sticker] Lawddd😍, love the dance too 🥰"",sticker;,,";
7601638110149608247,28 ans ici et ben non pas de vrais amis…,fr;
"c'est plus ou moins le cas partout"",fr;,,";
7642418143789368077,not reposting this but,en;
7017236099726869253,I am working on an elephant and an ant,en;
7259693769662202651,ahhh that's a wasted opportunity,en;
7629414720042795796,[Sticker] ela no final,sticker;
7130592882765529902,you to are cute like the dance and the slow motion,en;
7554328452465459990,They could have volunteered for aid the legal way by getting checked in by the military. They took the controversial route for clout to stroke their egos,en;
7416650513662509856,Cover your ears...the perfect future mom❤️,en;
answer is 21;,,
7642606176584450829,How I feel not being able to comment on Nasir king posts,en;
"  Acts   3 : 19 - 21"",en;,,";
7092086281760883462,c'est pas vrai,fr;
7641761502505321246,holy abs,en;
"7591215283521356564,""Idk. if we reformed our medical system I’m sure the people who need thick water could afford it at twice the price. There possibly even a way we can get this as a prescription for people who need it. Matter of fact, reforming our medical system would probably solve most major problems and small problems for majority of people."",en;,,";
7017888535424402182,Bro just said added a new species to the wild let’s see what happens ig,en;
"7612762103908598559,""et moi je suis genre l'élève dépasse le prof , je les rends invisibles quand bon me semble aussi et ça tous les jours😀🤣😂"",fr;,,";
7541087791703589663,How do you make sure the kataifi stays crunchy?,en;
7642545008030089991,this is exactly what i needed to hear today,en;
7248907381131805483,killing it,en;
7275838687908381445,bro looks immaculate now,en;
7517757332719141688,The same person who’s filming in the first clip,en;
7441728058090455864,PQ ESSE VÍDEO TEM MUITA CURTIDA E FAVORITADO?,fr;
7639787617131545366,[Sticker] Mr beast is this true?,sticker;
"7467254290600854277,""FYI - the remaining potato is not wasted, used more mash potato or chopped smaller for anything else 🤞🏼"",en;,,";
in the crotch of his pants at the beginning of this video but it doesn't say anything g about it.;,,
7634926018692547349,[Sticker] …,sticker;
7303704658584912671,Where are these lights from?!?!,en;
7364787897763021600,Nina dobrev has also an Porsche (i saw her driving at her beReal),en;
7439963647177048853,bentar lagi dijadiin unexpected edit r9 dance,en;
7017303945362490114,It looks like the turtle from gumball,en;
7508693051293778695,Co2 tighting procedure,en;
6977162374239552262,The 2nd house is literally the house from the coven ahs,en;
7305913183679841067,The most important question how long did it take you 🙃🧐🤨,en;
7642581416614871829,Literally Christmas Eve,en;
7324636534694724394,ITS TOO LATE FOR ME TO BE LAUGHING THIS HARD 😭,en;
7370091298625864479,I hope the car got home safe and everybody else ❤️‍🩹,en;
7508974007942431510,Its that but its also so your eyes can quicker adapt to the brightness to the outside incase of evacuation,en;
7461306597513872134,Coucou je veux comprendre le cours sur génétique,fr;
"7636918159542371090,""Guys dont comment, the longer the comment the more chance of getting it on your for you page. And we don’t want that, so be safe and don’t comment any long comments. Just keep it short. Actually, due to the fact that the hashtags don't say anything related to this type of content, then you will only most likely get more videos from this creator or not get these types of videos as much because of the hashtags taking over that section of what tt thinks you want to watch.Guys dont comment, the longer the comment the more chance of getting it on your for you page. And we don’t want that, so be safe and don’t comment any long comments. Just keep it short. Actually, due to the fact that the hashtags don't say anything related to this type of content, then you will only most likely get more videos from this creator or not get these types of videos as much because of the hashtags taking over that section of what tt thinks you want to watch."",en;,,";
7017489603779658502,It doesn’t belong in the wild you literally made it in a lab 😳,en;
"7160652539561165574,""Appelles une assistante sociale, vraiment."",fr;,,";
7642608446932665109,[Sticker] Why he eating alone bru,sticker;
7473130359014556471,Pour la reproduction SVP 🙏🙏🙏,fr;
les locaux aussi;,,
7561461836072567563,🤣🤣🤣 not me watching like I even expect to travel 😂,en;
7642549739258413845,[Sticker] and tomorrow raining,sticker;
7642661372089647880,aww thank youuuuuu 🥹,en;
7637620064926253846,[Sticker] Sonion,sticker;
7451393944367743750,Who is this Diva !!!✨,en;
7299514258827117355,this is GORGEOUS but those lights won't work for never year because fairy lights are so hard to keep when you unwrap them they get tangled to easy,en;
7641915096931255070,[Sticker] day ruined at 6:15 am,sticker;
7637806003694650133,fais du rap et soit meilleure dans ton sport. tu auras des amis,fr;
7641669486136181536,[Sticker] first time seeing bro smile,sticker;
7176519256358929194,that girl got everyone pressed lmfao,en;
7397343028359398176,The second one has nothing to do with physics,en;
7598137831324140289,mamaba forever indeed,en;
7370139620539138822,Gotta check the weather app 😅,en;
7236206639149073157,How are y’all so pretty,en;
"7035041591414211375,""A waitress at a bar did this for me! Came in with the guy I was dating and she remembered his drink order """"from the BLONDE girl you were with -"",en;,,";
7641350706071716630,😱😱😱😱 Bonsoir c est vraiment affreux !!!!,fr;
7322126665634480929,SPIN IS SMOOTHER THAN THE SONG😭🙏,en;
7364493009477600033,Mais dachi dit son nom!!,fr;
7629381802890101526,Pas d’accord quelque soit son statut??!!!!!,fr;
6909616999052263430,is this a last year video or a new video I'm confused 🤨,en;
"7160654600559018757,""Bonjour, prenez contact avec la DASU Mayotte (une bourse exceptionnelle peut être mise en place). Ensuite rapproché toi de l'assistante sociale"",fr;,,";
7034723328179372805,✍️befriend the staff at his favorite restaurant ✍️,en;
7636252931150938900,[Sticker] q asco los comentarios,sticker;
7641799576815485726,[Sticker] Yk that didn’t hurt,sticker;
6940772754283200518,thank you for speaking about this!!!!!!!,en;
7642535654392726286,i'm finally getting help for it,en;
7561144789988623117,Am I the only one worried about all the germs I will get when wrapping the toilet seat,en;
7166208721608033030,Damn it’s giving me goosebumps,en;
7299501032273756974,You’ve convinced me to buy a white Christmas tree,en;
7235966746020004651,The 2nd girl ate,en;
"7439062031204467489,""Il me plaît bien, je l’achète !"",fr;,,";
"its knafe"",en;,,";
7629880737768489759,Super early (does the baddie reply?!),en;
6979714139178943238,this actually helps us 🤝,en;
7034699868841607937,“oH yOU KnOw MeLiSsA”,en;
7613266918871024414,Joue le jeu bro…rien n’est réel,en;
7306290103227286303,OMG SHES ESPERANZA FROM RAISING DION!?!?,en;
6925979428930174981,I don't understand French but ooh chanze leezeh leeeeezeh 🎶,en;
7642935561711551263,jokes on you i ain pu that day js cuz of that🫩,en;
7449730120288830230,que jésus vous protège et vous bénisses amen,fr;
7642104670785749782,Cause we’re playing bendy,en;
7185211614958109441,Karim benzema King 👑 in football ⚽,en;
7632973588471563030,jai vecu un an aux usa et voyagé dans une dizaine d'états et j'ai pas du tout ce sentiment.... là je suis revenue en france je travaille dans le tourisme et il y a beaucoup d'américains donc oui ils voyagent,fr;
"7638427667646677791,""ici les amis c'est ceux qui ont grandi ensemble dans un même Block.C'est toute une culture, ceux qui ont vécu les mêmes sensations."",fr;,,";
7467002237996483370,Am I the only one that knew it was a potato at first🙈😭,en;
6977109268265304838,I’m posting a home tour this week on YT!!!,en;
6977091848989295361,have u been chased away from a mansion 😂,en;
7642119840850019102,Seing bro smile made me smile,en;
7641720049317135111,Look up The Reflection You Never Faced by Emma Vale and thank me later..,en;
7370749382281249566,She runs in a little winded but back to business as usual and then he runs in right after completely shook and still processing what just happened. 😆😂,en;
7595887339798463253,when Kobe is died .I'm bored to watched again NBA💔,en;
7639202286619919112,[Sticker] hey mommy,sticker;
7642383391422284551,[Sticker] broooooo,sticker;
7313411782482674474,Is it acoustic?,en;
7526674588639118136,no but who does that 💀,en;
7128253426958943022,What is the title of this song???,en;
7503457950364599062,Leaving the suitcase 🤣🙄,en;
7351285537066713863,MY JAW DROPPED (like he did),en;
7519880171685233421,can y'all just go with a joke for once..stop ruining the fun,en;
7634936015404745504,[Sticker] Interessant le lait par contre,sticker;
7642798622819484437,[Sticker] I sit in the front,sticker;
7618340641580024608,Freaknet is better🔥,en;
7612901369246515999,10 ans au USA pas damis🥺🥺🥺🥺🥺,fr;
7545641248629031688,Lovely Bastards lowkey a banger,en;
7397561090698609441,something tells me the one with the mirror wasnt fully legit,en;
7538724064136807190,Anyone need girl bsf?,en;
7177008505143837446,yo y los dolidos😂,en;
7301137055639225130,where are the lights from ?,en;
7641195728089645846,une horreur bâtiment lumière écran à gogo,fr;
7351094061371802410,What am I doing wrong,en;
7558890118402032406,The right girl😍,en;
7629933400384668429,I MEANNN ILL DO THAT JUST FOR A PERFECT LIGHTING,en;
7445876058015449902,YOOOO THIS WILL BE ME ONE DAY 😭💅,en;
7364035070787355397,GO YOHAN WHAT ARE YOU DOING IN JOLLIBEE😭,en;
7561203092592771854,why would you use your hand to hold the toilet seat to wrap it?,en;
7370129756190704427,Praying for everyone s safety,en;
7554222591856018206,MORE PROOF THAT REVOLUTION IS POSSIBLE AND GENERAL STRIKES ARE HIGHLY EFFECTIVE,en;
7636929868994806542,Lmaooooo😂😂,en;
"7621697861830624032,""What did you expect. They aren't exactly showing of their great sense of humor or a sparkling personality, their appearance is all we're being shown. And it isn't like they are being disparaging toward red shirt either."",en;,,";
"7300321771051205419,""everyone be like: I have black Christmas tree, white Christmas tree, pink Christmas tree;,,";
7638891553616921366,new studies show people who are like this are called otroverts,en;
7642954975543296789,can't wait until 28 may because we are going to beach,en;
7642856876723602189,[Sticker] oh.. i js be hanging up,sticker;
7542580880070640392,the bear aint choosin the woman😭,en;
"7642545070909965063,""if you've got a racing mind or anxiety or adhd and feel stuck, please read Clear The Noise by Leona Vale. it did more for me than months of trying everything else ❤️"",en;,,";
7257849667048162053,The only limit is your imagination 🔱,en;
7633063121331438344,[Sticker] It’s the phone being upside down for me,sticker;
7466957886879826734,Perfection my man👌,fr;
"7331486450201019179,""she should've made more per episode tbh, she carried that"",en;,,";
7407577884279407392,I was gona do this but nobody did it with me 😭,en;
7260501055846155051,i jus watched this last night wtf,en;
7364493515902632736,c'était son amie de base ?,fr;
7643064685478740737,Fresh ingredients in the comments huh,en;
7606712688231727902,Who is here in 2026,en;
7424589675765941024,bro hat skinwalker studiert,en;
7248869849546670853,cuando me dicen porque no te rindes : yo ví como un huevito o una cosa ovalada evito k lo aplastaran a toda costa,en;
7637661690691552001,pourquoi t'es en quête d'un ami américain? l'amitié se fait toute seulle dans ce que tu fais et vis.. c'est comme si tu dis j'ai envie de tomber amoureux mais j'y arrive pas 🙃,fr;
"7424761124698096389,""wait, do that again"",fr;,,";
"PLS LIKE THIS TOOK ME SO L"",sticker;,,";
7643062032883450631,[Sticker] All comments got likes except mine,sticker;
7126454293465973531,slow motion,fr;
7541087413357347614,i get mine at a persian grocery store! it’s in the freezer section,en;
7642970554463748897,[Sticker] kpop fans,sticker;
7554245825935180558,Free Congo 🇨🇩 -Free Palestine 🇵🇸 - Free Yemen 🇾🇪 - Free Sudan 🇸🇩 -Free Afghanistan 🇦🇫 - Free Haiti 🇭🇹 - Free Myanmar 🇲🇲 - Free Lebanon 🇱🇧 - Free Uganda 🇺🇬 - Free Somalia 🇸🇴 - Free Tigray⭐💛🟥 - Free Uyghurs ♥️- Free Ukraine 🇺🇦 - Free Kurdistan🇹🇯❤️☀️💚 - Free Georgia 🇬🇪 - Free the World 🌍 - Say no to war 👎 - Say yes to PEACE ✌,en;
"7640023036128969494,""c'est bof, après New York j'envisagerai plutôt d'aller à Chicago, à voir...C'est vrai qu'il nous faut marcher, à NYC nous avons fait 150km à pied en une semaine, mais l'aventure urbaine était magnifique."",fr;,,";
"7160654556053226245,""merci mille fois pour vos messages, j’essaie de tout lire"",fr;,,";
7077255434637918982,you need them to be close,en;
7305553310658986794,I remember raising Dion I miss it so much,en;
7635344940755960590,Who’s here in the big 26,en;
6992013520477389574,cómo se llama ese líquido yo necesito algo asi,en;
7629958870664987422,HAHHH IM CRYING EVERYONE IS JS FED UP,en;
7529837812902134536,Anyone need girl bsf?,en;
2. topography;,,
7635995010652422934,attention à votre santé,fr;
7160653416918123269,MA BELLE !!! Contacte une assistante sociale du crous !!! Fait un scandale ne lâche rien. Tu peux envoyer un courrier à macron (c pas une blague),fr;
7299694619511112491,This is sooo pretty but I know it’s gonna be hell taking it apart 😩,en;
7017376863769477893,Why ?!??😳,en;
7439546137231868728,[Sticker] el niño,sticker;
6925924180726792197,HOLY MOTHER OF GOD- WHAT!!!!!! THE TRANSITION FROM TALKING TO SINGING! THE CONTROL! THE TALENT!!😍😍😍😍😍,en;
7299393520040067870,I just know those are gonna be a pain to take down bc of the knots it’ll make but it’s so nice looking😭,en;
7160715823828534021,J’ai été dans la même situation que toi et on est dans la même école!! Alors si je peux t’aider ne serait ce que partager des repas ensemble 🙏❤️,fr;
"7628370254498480903,""busque la canción """"for you"""" y me apareció esto"",en;,,";
7464602165332984581,Who is also watching on Monday?😂,en;
7640108530158158612,please can anyone tell me the name of the movie? just curious,en;
7445881396193248018,will you be my spirit guide,en;
7520143710912709431,Did you end up getting ur Phone back??😭😅😅😅,en;
7279194500550836998,I like this one but the James charles one Looked amazing 😻,en;
7017285734659277573,Splinter mixed with a little donatello,en;
6972718294054945542,THATS DA BOYS FOR YA YOU GOT TO EXEPT IT 😏,en;
7642933063039402765,[Sticker] knowing damn well im not calling back,sticker;
7427491035565179681,WHY DOES PEOPLE BELIVE THIS😭😭😭😭😭😭,en;
7561498802608554808,ur already showing the tricks.. how won't the thief not know,en;
7378939397474911022,Aiden a real one yall just hating on a true baddie 😒,en;
"7541096938097459998,""Since the brownie is 9$ it would be 72$ for 8, so to spend 30$ to make it yourself, I hope yall can do math cuz that’s wayyyy cheaper"",en;,,";
7639222654482465554,i just called that introverted extrovert,en;
7520446450679120654,i flew a few days ago and they literally asked us to keep our blinds closed😭💔,en;
"7009420280858985222,""my sister just gets people to burp in the mic really loud, it's very entertaining :) there nice after"",en;,,";
7259575457716683525,THATS THE POINT!!!!,en;
7395975135259607813,this is not physics,en;
7400541375109972769,oh my daya 🙏🏻god blessed u girly,en;
7561490025352364821,why husband shirt,en;
7623999592099480340,jj io ne jij j jj ijji j. ujjn jb ijjn tu j jijij,fr;
6940781437344448518,I understand why people want to try it but literally just put jello in water and it's basically the same,en;
7471953482322084613,Mais où est la viande ?,fr;
7638488081067148064,Ici c’est comme le monde entier tu peux ressentir tous les continents ici,fr;
7642353781455749910,cuz were playing bendy,en;
7466948067965322030,This is a masterpiece,en;
7618293145580012319,Absolutely amazing eyes 🥰🥰🥰,en;
"7582165845432009503,""You look nice, Drew"",en;,,";
7300784961698857759,Best time of the year 🎄,en;
"7253238321476109099,""w vid, also would those highlights work well on curly hair?"",en;,,";
7520575549275439885,Very airline dependent. I’ve only had them be open on Hawaiian,en;
"7601643116396118839,""Je suis aux US depuis plus de 20 ans, même expérience!"",fr;,,";
"6943089123817586689,""yall dont say bøøst or use ton of emoji it will get marked as spam, anyway what's ur fav underrated song? mine is 'stone cold' by deb never"",en;,,";
7610848949456618262,“How many times did you watch this video?” Me: “yes”.,en;
7640137799521698582,[Sticker] 😁@,sticker;
7609064240230875917,thats actually a great idea,en;
7594166961715118880,by deleting it ?,en;
7636086532851958550,Oubliez pas que y a la TVA non incluse donc c’est bien plus cher que ce qu’il dit,fr;
7176495418665747243,Bro is the girls older brother 😂😂,en;
7416684766320624427,literally brought tears to my eyes,en;
7165919108977410822,Charles aznavour la Bohème qui ne ce demode pas,fr;
7642749942729392910,Bro all the comments like this making me think I watched the wrong movie 😭😭 How was this scary at all? It wasnt even too good im so confused by the ratings,en;
7458395262269686533,laisse nous enregistre tes vidéos svp 🙏,fr;
7130833468401484549,okey todos hablan del perro que se enoja pero yo hablo del chiquito el que nunca se rinde y siempre busca el modo de pasar,en;
7638005772233016086,salut !! j'ai une question pour toi ! je part en septembre étudier au US et je veix savoir comment tu fais pour avoir un forfait internet ?? avec une application ou avec un sim dans ton téléphone ?? merci à toi !,fr;
7557577583194637111,POV: the sunset when I don’t have my phone,en;
7453521295801025286,SVP vous pouvez publier les cours de terminale,fr;
7642916009494643473,[Sticker] Than it gets cancled,sticker;
7466985442392752942,Food prices are too high to waste that much potato.,en;
6973135947093820166,you do you dont let them get in your wht,en;
7629881260677153550,whatever makes you tea queen✌️✌️,en;
"7601723957741536030,""C’est vrai 21 ans ici, j’étais aussi étudiante. J’ai jamais pu faire des amis. J’ai des connaissances mais pas d’amies"",fr;,,";
"7554266993706648342,""Exactly why in the US , unions are being painted as something negative."",en;,,";
7627548553930195730,[Sticker] this for you mama,sticker;
7570114352788374294,second hashtag is funny😂,en;
7632061671867876126,Who’s here in 2026?,en;
7583109056538215190,Nice Dance 💃💫 Wanna do the same to my new song “City Lights Calling” Thats out today 🌟🎧 Stellar K,en;
7642704144625337110,[Sticker] me,sticker;
7641596211581993746,i really need God guide me until i become a man of God,en;
7642651570928599826,[Sticker] and it got cancelled,sticker;
7566048393979659026,why is satan behing ariana grande? Jesus loves you guys btw.,en;
"7642313402539754262,""[Sticker] """"yeah i like kpop"""""",sticker;,,";
7507913368352260871,what is this,en;
7390035543238640416,PLaY dReSs To ImPrEsS wItH mY BADDIESSS 💅,en;
7642798701248922388,[Sticker] Then she’s suddenly already at your desk,sticker;
7259501615332688682,Please you still didn’t tell us what you do,en;
7417006930134401824,« I need you to cover your ears… »,en;
6972350296555782918,You made all these voices? 😂,en;
7200925804112364330,OMG that scared me,en;
7594017661316268818,Table is better then chair,en;
7370148572929622827,yesterday was my Birthday 5/16. I'm sorry for the people from Houston.,en;
7425199863137239840,Je remet la vidéo j’ai pas bien vu,fr;
"7580022257260331798,""no, they’re not? is thick water low on supply? it’s not, it’s radially available. yes, people do need it, that’s why it exists, but people buying it just to try it out is not bizzare or wrong. products like these (thick water, water with electrolytes etc) are common things found on supermarkets. you’re not entitled to certain products just because. if it’s not causing an issue with supply, I don’t think it’s bad."",en;,,";
7249107582857675525,Nonnnnnnnnnnnnnnnnnnnnnnnnnnnnnnnn il avait sûrement des projets,fr;
7398909336272503583,THSI IS ACTUALLYyososksjdns IM GONNA CRY 😭,en;
7642935735726048030,Literally rn,en;
7253232118121546522,I am utterly insane,en;
7640042146171716374,Tu fais que de marcher... Première sortie en tant que touriste?,fr;
6941053674323968006,I’ve heard that gelatin and (regular) water mimics the taste pretty well! :),en;
7173551320359207685,and they criticized paris and messi last season🤣. so unlucky to be honest they were one of the favourites for the ucl and still r,en;
7641968251606319894,thank youuuuuu,en;
7389655984862266144,The way he tried to embarrass Aiden,en;
7642858819332899606,[Sticker] So you go to their most recent video but no one talks about the video you watched,sticker;
7306988987982611246,RAISING DION,en;
7608589278962762499,what now?,en;
"7569500787241829138,""You are so beautiful, my dears. Come to Egypt, the land of men. 🥰🥰🥰🥰🥰🥰"",en;,,";
7338919589626446600,the last one just threw up 😭😭,en;
6977163744967492358,So TVDU fan’s thinking what I’m thinking on the second house or...😳,en;
7365384881502864170,Why no one talking about the car prices?,en;
7609679218981995277,hiiii!! thank you so much 🫶🏻,en;
7639264940931482399,[Sticker] Why didn’t she just use the TikTok light,sticker;
7034976952449909550,So we all just listened for the hair? 🔥,en;
7643060734758372104,[Sticker] We all online,sticker;
7459875334038078213,R9 unexpected edit,en;
"7247900985078334214,""""""Vence al resto, yo solo te veré hacerlo ya que conmigo nunca podrás"""""",en;,,";
7307915032846353157,can someone explain to me what is Raising Dion 🥺 im lost i know nothing about it,en;
6949385921230209029,why would this even be a trend omg.....,en;
6977155406510981894,I'm still waiting for someone to say 'I'm a full time tiktoker',en;
7632455644242625294,WAIT,fr;
"7596798282791207692,""Pareciera mentira de verdad, que Kobe y su hija QEPD 🥹🥹 tu amigo y admirador LeBron James le pegó bastante tú muerte y ganó ese campeonato en honor a tí, Mamba Forever 🙏🙏"",fr;,,";
"7642820937284862733,""as someone who doesn’t do horror movies, this movie was amazing! Just lots of jumpscares and creepy scenes 10/10"",en;,,";
7387654821790991110,PLAY DRESS TO IMPRESS WITH MY BADDIES 💋,en;
7017447916391072517,Why did you create this,en;
7632778017241137934,Newest comment btw,fr;
7642190037836481294,I don't get it please explain I can't see the sound name,en;
