comment_id,comment_text,language;
6926244632611602437,I’ve never replayed a video so much,en;
7642573151024628488,[Sticker] me:,sticker;
7619497589889467159,i didn’t even need to read the bio to believe it i was already thinking it,en;
7496165632699237142,😂😂😂 I'm easily amused 👀😂❤️❤️,en;
7608267264773341970,I need romantic bestie,en;
"7579442060982600464,""yo 10 veces, doble para cada una🗣"",en;,,";
6940816380376137733,It you want to try it just put unflavored gelatin in water. About the same texture,en;
7590866239284544276,[Sticker] La calabazaaaaa!!!,sticker;
7561889031966802710,i saw this vid then i wanted to look is there any jump scares but i saw the dog was coming so o didn't get any goose bumps,en;
7176496359573553963,He acted like her so perfectly,en;
7017311358702273285,Bro made it in the lab then put it in the wild saying that they belong there cmon man 😅,en;
7574895600278274817,This is the reason people ARENT coming here,en;
"7642107471696691982,""Okay. Why are we hating on an idol. First of all, humans cry. Second of all, fans shouldn’t be throwing things at them. And third of all, what has she done to you? Like leave her alone"",en;,,";
7338354916887216902,The last cup is caterefe,en;
7612710982783337232,[Sticker] muhehehehe,sticker;
6940781555481133062,don't mind me just learning to count,en;
"7235939685494260506,""If I did this with all my friends, we just look like we belong in a prison"",en;,,";
7632057958399197985,[Sticker] R,sticker;
7300821596784575274,i need 3days😂,en;
6940782140053766149,b0ost : what’s your birthday ?,en;
7215380847846982402,Excuse Me 😎 You now have my Attention ❤️,en;
"7629397314055209750,""Moi je pense qu’ils auraient dû faire un concept où ceux qui ont besoin du crous à 1€ le demandent ,parce qu’il y en a qui n’en ont pas besoin et qui s’en passeraient"",fr;,,";
7609823597335790366,Absolutely Beautiful and very Pretty ❤️❤️❤️❤️❤️❤️❤️❤️❤️❤️❤️❤️❤️,en;
7402631971220308742,why no one talking about the flash on the camera😭,en;
7620395656260174614,Do you post every day? Tryna keep up 😅,en;
7173795020343001861,Bro drinking speed potions before the game,en;
7553578838150071047,its ok.its your daily homework😁😂😂😂,en;
7259538642774164225,No but her question still stands,fr;
"7034686303979913990,""Giving you these 🧿🧿🧿🧿 because you’ve been getting a lotttttt of comments, just to ward off the negativity"",en;,,";
7640899936016794390,i searched up fyp...,en;
7609352334691435278,One with the. Black shirt,en;
7618844682839573270,how did you learn this?,en;
7624492824785322773,[Sticker] They Ocean Meme,sticker;
7642791098235306765,It was literally so good grow up 😭,en;
7079894913269613354,What! How could be real!!,en;
7641443674843185928,Self improvement makes me the happiest,en;
7123997959427490566,de le monsieur adorable je l'aime bien j'allais me love il parle pas pour moi moi je m'appelle Aya et moi je m'appelle Aya il connaît rien de moi j'ha,fr;
7642107692970246926,[Sticker] Me when they ask abt it,sticker;
7391006745298830085,Why would you even go out in this weather?,en;
7643060451764601620,[Sticker] I guess we're all online rn.,sticker;
7612196941575766787,I swear i was staring respectfully😐,en;
7640895911522566933,Watch my last vedio to the last…,en;
7160819496739947269,Elle me fait de la peine… faites la percer les garssss !!,fr;
"7629845226228433695,""Chaque état est un pays. Je vis aux USA depuis 10 ans, et chaque annee ma femme et moi on va en vacances dans un état different. Je n’ai jamais senti la necessite de quitter le pays."",fr;,,";
7547951530859971350,Nature is beautiful ❤️,en;
7643007573620917010,[Sticker] Attendance list of those who watched the video on Saturday,sticker;
7562887168810566420,location?,fr;
7640195270710608654,felicitation,fr;
7642232361786147615,Why this on my fyp in 2026✌️😭🥀🥀🥀,en;
7577451267062448904,I would volunteer to be the Arabian,en;
7642791444528612127,[Sticker] How? The teacher is at your house???,sticker;
7617950053319820052,hola hermosura saludos y besitos cuidate mucho éxito en tu día bebé 🥰😘😱,fr;
7643019544982586144,[Sticker] Bro didn't finish watching the video,sticker;
7637495075132965633,[Sticker] I don't care,sticker;
7439087553498923798,what core is this😭🙏,en;
7637538084553098006,I accidentally clicked for you page😭,en;
7640799811189392149,i literally just searched foryou by accidentally pressing the hashtag🥀,en;
7550392767325504278,„I need you to cover your ears honey “,en;
7521884024434328326,not me and u having the same pink suit 🥺❤️,en;
"7051886699337188097,""The """"sImPpPpppp"""""",en;,,";
7080070774455354158,You don't see that every day. 🙄,en;
7445731553974682399,Uhm so this is really bad cause my fyp is a mix between both but the good part is it’s mainly about the faith side so that’s good,en;
"Courage à tout nos jeunes…❤️🙏🏼"",fr;,,";
7601539406662828830,Tu a raison ça fait 3ans que je vie au usa je n’ai aucun amis américains,fr;
"7629376333555368726,""Ça c'est une révolution, ça aidera vraiment les étudiants"",fr;,,";
"7177007664537944858,""di bully sekelas ❌;,,";
7330523402120364806,Shaun is a snowboarder not a skateboarder 💫,en;
7561443840058606350,Now everyone knows about the money hiding place,en;
7636842793763472149,[Sticker] de color es la camisa,sticker;
7506557247528239893,this is real ya fake???,en;
7552254403434119958,Fr,en;
7642882732712084238,Bro I never experienced no shi like this,en;
7642779494718538526,Damn yall are dramatic 😭,en;
"7642717788162999053,""Exactly, I am realizing now that if I want better, I have to do better🙌🏾👏🏾"",en;,,";
7609435514698351382,Right I’d start an argument over ts,fr;
7389234105806422800,dress to impress with the baddies 💀💀,en;
7337841181038084869,Last one is so real,en;
"7639492745787097864,""en 2026, on estime qu'environ 45% à 50% des américains possèdent un passeport valide. Mais ils ont commencés à s'ouvrir au monde depuis 2024. en 2024 il y a eu une hausse de demande de passeport à plus de 24 millions de passeports."",fr;,,";
7639178503262765845,are they fake????,en;
7364824561525097221,Shame I don’t understand but I feel for you,en;
7558559732135494422,THANK YOU❤❤❤,en;
7642586524546401044,[Sticker] same brooooooooo...,sticker;
7642393988469195550,why’s this so relatable,en;
6977432917676983046,so your saying i just gotta own a mcdonald’s,en;
7635197078554542856,[Sticker] yo te acompaño jajaja,sticker;
7638245842844304136,the boy reaction after he fell😭,en;
"7468355027703923478,""Y’all know you don’t have to throw away rest of the potato, right?"",en;,,";
6910343189610659845,yo viendolo en 25 de diciembre 2020,en;
7522454303019090744,What did she use to record herself out of the plane,en;
7515852587446403886,bro she was the realest one in the whole movie,en;
7642661261775504136,yayy thank youuuu,en;
7561389929143796482,The husband's shirt 😂😂😂😂,en;
7584861525027980049,I love the new hair,en;
7279189580555846401,Ask for the products Kayla!!!!,en;
7633910123090232084,[Sticker] automáticamente yo xd,sticker;
7635764144528556831,god please heal the sick andweak and hungry the downtroden the broke ones in a finacial sense the ones who need you heavenly father in jesus name amen.,en;
7595682978077426462,Love the dress and the bathroom selfie setting is so on point.,en;
7558470248035975958,Where are the pants from?💘,en;
7433400010961650448,why did she say it so calmly,en;
7246904929624244993,bro was still standing for 5 generations and saw his whole family dying in front of him,en;
7424612386445230866,STOP WHY DONT WE,en;
7253232753017045806,bros voice is majestic,en;
7638213730114847508,I searched fyp and ts came up,en;
7625893452223447829,[Sticker] let's dance for mama,sticker;
7608680020260832031,Tell the one in the black I said I hope she has a beautiful day,en;
𝗗𝗘 tu vida algo tan bello.;,,
7642981611638063885,“Sorry I fell asleep” while being in the car otw to McDonald’s,en;
7087215541009711878,Single ladies make real friends. Can we make friends with each other?,en;
7629382401528955670,Tellement hâte !!!,fr;
"6909470486607265794,""✨ If you know, you know. ✨"",en;,,";
6978018102860972806,One day he’ll be knocking on my door,en;
7642657113403491073,[Sticker] she's behind me isn't she?,sticker;
7370794626476901121,Old is gold,en;
6977159486390371077,I swear he went to the white house,en;
7642090368112509718,Because once you act happy in front of them you just can’t stop,en;
7416189601448493854,This had my adrenaline pumping. So glad she was safe,en;
"7006510368604799749,""for those who don’t know, les Champs Elysees is a shopping mall in Paris, this person is singing about a date there (I think)"",en;,,";
7595832323912909586,the day when the world of basketball fans stop😭,en;
7642540404591772424,Can you do the Billy bounce dance,en;
7629362868819886870,« Est-ce qu’en France vous habitez dans la Tour Eiffel » alors Cindy là jsp quoi répondre,fr;
7358326009232081707,This video deserves all the love its getting. Well-deserved!,en;
"7617499579068433174,""""""Assets"""" contribute to beauty, a human is composed not of their face but all of themselves, counting in personality and character."",en;,,";
7370130574144865054,Being stuck on the freeway thru this was the scariest thing 😫,en;
7371082202002834182,deve ser pq a única pessoa que se importou com isso é vc esquisito,fr;
7236211680026968875,LITERALLY GORGEOUS,en;
7521405585682793238,I didn’t lose it in the first place 😂,en;
7306262301664920321,SHES THE GIRL FROM RAISING DION!!! LOVE HER❤️,en;
7642060852950156045,“So where are the bath towels??”,en;
7642632199346602766,[Sticker] Wait why is she so good at dancing,sticker;
7017284864600949509,THEY ARE SO ADORABLE I CAN'T STAND IT,en;
7237092174412104453,pretty friends are flexsssss,en;
7017280936459633413,Man is playing god,en;
"7350606097830462214,""Fueron ellos, no yo"",en;,,";
7363992502670295813,I thought I was the only one who thought of YOHAN 😭,en;
7073860275032064773,je me demande quel programmes ils utilisent pour tous ces effets spéciaux ??? 😂😂,fr;
7642768714698048278,[Sticker] but i don’t even know how.,sticker;
7561088216091542284,why husband?🤣🤣,en;
7421099327454298898,that is ai dude,en;
7642585970281513746,thank you,en;
7608773484718654221,Don’t ask me the color of NOTHING!,en;
7464690770369757957,Do these people need to have fridges ?????,en;
7643031815230604054,Just know there someone out there making a sad edit about this,en;
7038989228840534830,Girl your story telling is amazing,en;
7259575421699621638,i promise u the joke is VERY meta,en;
7642016421212668704,j’ai vrm été y’a 2 semaine dans les petits truc c’est 1 dollars la boisson (fanta coca etc) on était 3 chaque fois 3 dollars donc ça fait 2€ et qlq pour 3 boissons,fr;
"7300035325716726574,""Am I the only one with a plain green tree decked out in multi color lights, garland, and random ornaments my kids made me at school? lol"",en;,,";
"7634815805288628999,""You see the video.;,,";
7642959151761589008,idk who tf is king Nasir but it’s him,en;
7439106801206231840,el oro va en España Bro,en;
7610173527777805077,the girl in the jeans ate 😝,en;
7623380603241071382,[Sticker] PARTY IN THE BEACH DOWN IN COPACABANA,sticker;
7166166171254211334,le talent français 🎼🇨🇵,fr;
7417930903530488607,my jaw dropped when she said that 😭,en;
"7246951799491248938,""STOP THE MACHINE, he's the chosen one"",en;,,";
7639811569500947232,je préfère la maison Blanche de Marseille,fr;
7496798183499416350,This looks like the scream-cheese from Hotel Transylvania,en;
3) 🛋️🤳;,,
6991089804927058693,Je préférais en blanc,fr;
7321880840568750880,Those are actually moves i am going to put in my dance for my compatition,en;
7562372187111457554,Yo entrando al cielo,en;
7642051376986030870,[Sticker] crying with autotune💔,sticker;
7642446136427528967,Mais ils sont sympas ❤️,fr;
7642794271393694486,I’m not falling for this again 🙄🙄🙄,en;
7496205588847526678,I need boyfriend,en;
"7561120158899618615,""I watched this like 4 times tryingto figure out why a guy was putting a sanitary napkin;,,";
7322704349451371306,Someone animate gojo doing this dance,en;
7643064207941141266,Why comments so fresh,en;
7541365098301981447,I need to looose weight yall stop making em hungry,en;
"Believe in Him, repent, forgive your neighbors. Love everyone, even if they do things you don't agree with. Jesus would want you to forgive them, as He does. Forgive each and every one. It's not too late to repent. I'm not forcing my religion, I just want to see you all in heaven. In the name of Jesus we say?"",en;,,";
7515926379203740462,Straw messed my head up tho,en;
7434206226785698592,THE BOTTLE GOT THE “SHE WAS A FAIRY” TOO SERIUSLY,en;
7610501346739503885,why is that what we’re paying attention to? who’s prettier? why can’t we appreciate both.,en;
6910267232283246593,pov: your watching this on 25 december,en;
6991244563210388229,What that stuff called in the bucket,en;
7520151265919451959,wat are you recording on,en;
7129034943687213830,They are so cute ❤️❤️,en;
1) 🚽🤳;,,
7629881751167501072,[Sticker] HAHAHAHA CUTEEEE,sticker;
7634498253535052564,[Sticker] Hmmmm what are you thinking about bro like chill man,sticker;
7590915481374229261,Is that a different way of saying luberacant 😁,en;
"7358821777558848261,""chicas, chicas, chicas, disfruten DISFRUTEN LA ERA DE SUS FAVS CON PATANLON JEANS AJUSTADO, PQ UN DIA DEJAN DE USAR Y CHAU😭😭😭😭 (soy army, y extraño biti 2017)"",fr;,,";
7331707739581760257,the choso's edit haaaaaaaa😩😩😩,en;
7642646992501981984,Who still goes to school 🥀💔,en;
7366255765180859168,« A la sueur de mon froann » PTDR,fr;
7589356987037549334,Found the vatnik,en;
"7364060882689016582,""PQ LE VI CARA DE JOOHEON!!? 😭😭😭(lo extraño, okey)"",fr;,,";
7482499246454883127,merci encore plus d'informations sur les organites de la cellule,fr;
7129199166512841477,Mom where’s the toilet paper,en;
7642646378966975250,[Sticker] Nth nhnhñ mhnhm,sticker;
7324806635615601454,3rd guy transcended reality😭😭,en;
6977374828890309377,Wait what own a McDonald’s store and u rich ? Why lol,en;
"7642297151044715285,""Is this Ai or real,maybe😳😁😳😁😳😁"",en;,,";
7424414980734567188,He definitely did that on purpose,en;
7626636474213319445,The one on the left baddie,en;
7035727778108752646,You a real 1 for looking out for Melissa 😅😂,en;
7629598559261197078,alors oui c'est une bonne chose mais si tu n'as pas de CROUS a côté de ton lieu d'étude ça ne change rien,fr;
7641590853841322784,Il raconte n'importe quoi. La taxe à New-York est de 8% contre 21% en Belgique... quand tu vas qu'une bouteille d'eau de 2L À New-York coûte moins de 1.89$ pour une marque comme fiji contre 4€ la mini bouteille de fiji en Belgique. c'est rien. par contre si tu te fais arnaquer dans les lieux touristiques c'est clair que c'est chère 😂,fr;
7586676975999583007,where did you find this dress i love it my grandaughters would so love this and you look amazing,en;
"7642777236953891614,""this is how i was w smile 2, debating if i should go see obsession😅"",en;,,";
7635010737744200470,[Sticker] yk what… pop off girl,sticker;
7642842391649043231,idk she be calling me back yall,en;
7325246214470484779,😭 the first guy I canttttt,en;
7553806722688795422,Wow! Crazy what nature can do!,en;
7601560954913276685,I have been here for 13 years. All my friends are still back home. 😭🤣,en;
"7637955449190597398,""Il y a beaucoup d’Americains qui eux-mêmes n’ont pas d’amis. J’ai habité à New York et beaucoup de mes collègues passaient leurs week-ends à la gym ou au ciné seuls. Pour la fac, tu verras que tu vas te faire + d’amis en dehors du cercle universitaire. Mon conseil: rejoins une association de volontariat ou culturelle (théâtre, photo, peinture) locale. Il y aura des gens plus matures et ouverts d’esprit"",fr;,,";
"7515972243354141486,""That song tho in the beginning, what is that song called"",en;,,";
7523238164771144470,fake. The window shades should be raised during landing and the flight attendants will check it,en;
7160645448385479430,je suis sincèrement désolée pour toi. courage courage,fr;
7560675052171395862,Wow my fyp is Marvel and Dane DeHaan 😭,en;
7546331964627747606,why are they making it tightee,en;
7634841608274281238,ca fait rêver qui ?,fr;
7629651566937342743,Ptdr tu paies pas d’impôt respire,fr;
7640524884465140502,This was not what I was looking for,en;
7641460327923057426,WHY U R SO CUTE STOP,en;
7350493613090603818,the way she just looks at you on the floor 😭,en;
7424517195790074657,how were we supposed to stay focused after THAT,en;
"7619726916039688973,""@mika 💗:@Robwin: @Herewego1011: @MAX: @rr:@dootie..2:It takes at least 500 words in comments to build recommendations? Algorithms analyze context and semantic connections. Fewer words - higher risk of inaccurate advice! Why 6? This is the minimum amount for algorithms to capture key topics: for example, """"the film is cool"""" - too abstract, and """"the film is cool, but the ending disappointed"""" - already shows emotions and details. The more words, the more accurately the system will determine your preferences. Write expanded: """"I love drama with unexpected twists"""" instead of """"cool movie."""" So the recommendations will become personalized, not random. Remember: every word is a hint for the algorithim!: It takes at least 500 words in comments to build recommendations? Algorithms analyze context and semantic connections. Fewer words - higher risk of inaccurate advice! Why 6? This is the minimum amount for algorithms to capture key topics: for example, """"the film is cool"""" - too abstract, and """"the film is cool, but the ending disappointed"""" - already shows emotions and details. The more words, the more accurately the system will determine your preferences. Write expanded: """"I love drama with unexpected twists"""" instead of """"cool movie."""" So the recommendations will become personalized, not random. Remember: every word is a hint for the algorithim!: It takes at least 500 words in comments to build recommendations? Algorithms analyze context and semantic connections. Fewer words - higher risk of inaccurate advice! Why 6? This is the minimum amount for algorithms to capture key topics: for example, """"the film is cool"""" - too abstract, and """"the film is cool, but the ending disappointed"""" - already shows emotions and details. The more words, the more accurately the system will determine your preferences. Write expanded: """"I love drama with unexpected twists"""" instead of """"cool movie."""" So the recommendations will become personalized, not random. Remember: every word is a hint for the algorithim!: It takes at least 500 words in comments to build recommendations? Algorithms analyze context and semantic connections. Fewer words - higher risk of inaccurate advice! Why 6? This is the minimum amoun"",en;,,";
7642339107041264404,stop bullying her she's only 30teen,en;
7321872376324293406,the spin was so perfect 😭❤️,en;
7575795672030544648,Really who discover milk?😂😂😂,en;
7350501724174893867,My jaw dropped😭😭😭,en;
7299699476302021381,moi je fais ça je garde le sapin même l'été,fr;
7552473391246525200,why. he loves you,en;
7561962623085462327,money in a sanitary napkin😳 you just told them🤣🤣🤣🤣,en;
7629880779543773960,earlyyy,en;
"7623400581591204630,""Trump is a genius.;,,";
7642921279797068565,Thank u bro 🥰,en;
7541171003973518110,dude omg. those are my ACTUAL FAV!! i just never get through all the bags of brownie mix before the expiration date so i haven’t bought them in a while 😭💔💔,en;
7601513983854445333,[Sticker] Этот пацан типо,sticker;
7316230536942666542,THE GIRL FROM RAISING DION OMG,en;
7364063710343119622,IS THAT THE GUY FROM SIGN?!,en;
7641653900194398998,Tu dis de la d je rentre de NY après 8 jours c’est comme à Paris,fr;
7176494822772081451,why do you look like her lmao😭😭,en;
7642591607388242710,[Sticker] And then the teacher decides to start from you,sticker;
7632413572979852045,You know who you look like?,en;
7446161054399464225,Future me vibing the weeknd yass,en;
7590973253984731912,Bro tiene palanca de cambios :0,en;
"7522854308808606471,""""""Play dress to impress with my baddies"""""",en;,,";
"7416413324127503147,""I know, right? She's a warrior mommy! I loved that response!"",en;,,";
6975603798962537221,literally when i troll kids bro 😭,en;
7642806167945478926,[Sticker] Can’t do this we both bi to nooo,sticker;
7639787849378792223,[Sticker] and I love that for me,sticker;
7634169445707350792,[Sticker] yess...yess...yeahhh..owhh...shitt,sticker;
7642497830892028702,[Sticker] there's a 50% chance some of her fans cried with her,sticker;
7615973803383243542,Tu travailles pour toi et que pour toi !,fr;
"7561375104950960918,""Well, crooks will be opening your pads! You just told everyone!"",en;,,";
7629885395325829919,Omgggg,en;
"STRANGE."",en;,,";
7642301461947024149,you listened to one bad song,en;
6926009410549121030,u could literally curse my entire family line singing in french and i would thanky you,en;
7300791713772274474,I need to know how you put your light on . That's absolutely perfect . 🥰,en;
7358711203190080261,NIKI'S HAIR IS JUST EVERYTHING TO ME🧘‍♀️,en;
7633802522294256406,Comment ça donne pas envie,fr;
"7642727366191842070,""[Sticker] and then bro creams out loud """"wait didn't you do the homework?"""""",sticker;,,";
7610814825501901588,fr,en;
7519786277475681079,The airline I flew on said we had to keep them closed during takeoff and landing,en;
7632696457624519442,[Sticker] Cuánto cuesta,sticker;
"7642581191962952470,""[Sticker] """"Where is your homework?"""""",sticker;,,";
7642920632407163668,Franchement 🥰,fr;
7247067400326873858,am still standing 💯💯🔥🔥,en;
7315973273536512814,Better that me omg,en;
7491361730636333829,merci,fr;
7642707862875898656,ok j'm'en vais 😂😂😂😂😂😂,fr;
7608985616801743629,Lmao yo ts frying me 😂,en;
7641199466029122326,C est time square quoi 🤷‍♂️,fr;
7640731143977648914,And thats why i love gravity,en;
7370098201751438126,The car😭,en;
7637365860986536726,Yeah got a problem with that,en;
7561819969424753415,so why is that guy putting on pad?,en;
7632058099947504416,[Sticker] 😵s,sticker;
7117340726345908997,Anyone know the shoes? please,en;
"7617577482274947861,""Alguien más espero la vuelta, o solo fui yo 😅"",en;,,";
7190080537997214466,It's forbidden to explore the solution in Fedoni!?!?,en;
7609063333844828941,how are you BOTH so tea,en;
7429424801763607329,U just called me pure in all ways possible,en;
7641442069421376287,[Sticker] You guys do know this is rage bait,sticker;
7253239182977712922,Any tips for growing your hair out?,en;
7637536968591180566,j'fais du rap ton avis 🎤,fr;
7034694331563475717,Sis I can’t concentrate on a count of the boss a$$ hair 😍😍,en;
7017214075046626053,That turtle from amazing world of gumball 💀,en;
7520202139718828813,Holy moly people take shi way to much to heart these days let her do a bit😭,en;
7424463668819018514,Why does the search say when he takes off his hoodie😭💀,en;
7641247910630441735,God bless you 🙏,en;
7322404506600997678,My FYP is full of Call of Duty men. HELP.,en;
6941739797098938373,wait so am i not able to buy baby food cause it's just for babies 😬,fr;
7642893293383549718,[Sticker] It genuinely be like this,sticker;
7173545093478351622,je suis pour le real mais mettez navas au goal,fr;
7540888586338632479,it’s pronounced ko-naffa,en;
"7623575312064463630,""yes , they always say french ppl are rude. les français sont très directs, ils n'aiment pas ça 🤣"",fr;,,";
7133172548766696235,You guys rocked this 🥰🥰,en;
7642431266982576918,bravo et bonne continuation 👏👏,fr;
7034715786326721327,“Ohhhh” … “YOU TRIFLIN AHH” 😂😂😭,en;
7640652744005206798,Mind you his phone is upside down✌️,en;
7641668401719804695,Slowly making friends i see the progress ❤️,en;
7253307928185357099,Bro get a fade😭😭,en;
7551692584910717718,No but seriously… how did they discover milk…,en;
7643068929360560904,[Sticker] we're watching ts on saturday..right?!,sticker;
7235908891593573128,The second one is wow,en;
6972461407954699014,“WAIT ARE U BAD THO” AHHHDHCHAHADHA 🤣,en;
"the watcher:👤"",en;,,";
7641958776577180438,I would totally date you no joke,en;
7643057846339011336,[Sticker] So we're all online?,sticker;
7524057197556204302,Sometimes you don’t have to,en;
7370091530156606254,Houston thought it was going to be a regular rainy day. BS we got that notification on the hour TORNADO ⚠️📢 🚨,en;
7207531239186907909,Nahh 😂😂😂 this is funny as hell,en;
7236088957875487494,The prettiest side eyes I’ve ever seen in my life,en;
7642560003442672401,marry him or live my comment,fr;
7421336047025603359,How they even make the giraffe so realistic,en;
7358882780602762017,I need this live in London.,en;
7324857571328082731,THE THIRD ONE BRO 😭,en;
7643068424750416653,Im the 19342 comment that deserves a like,en;
6972350494035493638,this is why i pretend i’m a little boy lmfao,en;
